{
  "schema_version": 1,
  "experiment_type": "trial",
  "task": {
    "trial_prompt": "Is this sentence natural? Answer only Y or N."
  },
  "materials": [
    {
      "item": 1,
      "material": "The teacher praised the student.",
      "conditions": {"Condition": "Control"}
    },
    {
      "item": 2,
      "material": "The sandwich frightened the doctor.",
      "conditions": {"Condition": "Anomalous"},
      "trial_prompt": null
    }
  ],
  "runtime": {
    "model_key": "deepseek-flash",
    "generation_interface": "chat",
    "system_content": "Answer using only Y or N.",
    "repeats": 1,
    "random": false,
    "stream": false,
    "timeout": 120,
    "parameter_policy": "explicit",
    "parameters": {
      "max_tokens": 512,
      "thinking": {"type": "disabled"}
    }
  }
}
